深蓝汽车北京长阳店,北京市房山区长阳镇太阳圣火广场9号厅,116.170041,39.773402,北京市,北京市,13522390310,杜一帛,15010723515,1
深蓝汽车北京丰台洋桥店,北京市丰台区南三环中路洋桥西一号,116.372927,39.855813,北京市,北京市,15811284309,林帅,15811284309,1
深蓝汽车北京海淀四季青店,北京市海淀区巨山路99号合盛汽车园内,116.232858,39.947121,北京市,北京市,18600708001,邵振江,18600708001,1
深蓝汽车北京排山汽车城移动展厅,北京市密云区十里堡镇排山汽车城,116.794475,40.356157,北京市,北京市,69075298,,,6
深蓝汽车北京顺义李桥镇移动展厅,北京市顺义区李桥镇顺通路李桥段26号,116.667984,40.048579,北京市,北京市,13366822732,,,6
深蓝汽车北京房山阎村移动展厅,北京市房山区阎村镇炒米店村委会北456米,116.101966,39.720017,北京市,北京市,15010723515,,,6
深蓝汽车北京马甸桥店,北京市海淀区祁家豁子甲2号,116.380669,39.976287,北京市,北京市,153-00103890,周士伟,15300103890,1
深蓝汽车北京密云店,北京市密云区十里堡镇十里堡村东100米,116.795381,40.352166,北京市,北京市,010-69075298,刘杰,18518645906,1
深蓝汽车北京五方桥店,北京市朝阳区王四营乡孛罗营村北1街1号,116.546733,39.863914,北京市,北京市,13366822753,张伟锋,13366822753,1
深蓝汽车北京朝阳小红门店,北京市朝阳区小红门乡肖村南四环东路91号,116.43425,39.833212,北京市,北京市,13366822869,裴雷贺,13366822869,1
深蓝汽车北京海淀四季青店,北京市海淀区四季青镇巨山路99号合盛汽车园,116.234175,39.947118,北京市,北京市,010-88434905,陈效存,15801532765,2
深蓝汽车北京朝阳小红门店,北京市朝阳区小红门乡肖村南四环东路91号,116.434224,39.833179,北京市,北京市,010-51317788,陈冀川,13366831237,2
深蓝汽车北京杜家坎店,北京市丰台区长辛店杜家坎1号平房,116.205914,39.843072,北京市,北京市,010-83868100,曹晨晨,13661339143,2
深蓝汽车北京通州店,北京市通州区永顺镇富河大街315号,116.646165,39.927168,北京市,北京市,010-60596578,刘然,13581927785,2
深蓝汽车北京密云店,北京密云县十里堡镇十里堡村东100米,116.795381,40.352166,北京市,北京市,010-69075210,罗贺鑫,18518645912,2
深蓝汽车北京长阳店,北京市房山区京周路太阳圣火广场9号,116.170943,39.773489,北京市,北京市,010-80308868,张珂军,13810299769,2
深蓝汽车北京顺义区店,北京市顺义区李桥镇顺通路李桥段26号,116.667984,40.048579,北京市,北京市,18610239519,王志永,18632316650,2
长安交付中心北京顺义机场东路店,北京市顺义区澜西园三区38号楼一层（顺创）,116.63,40.11,北京市,北京市,010-89449660,李安然,18410195799,3
深蓝汽车北京南口路专区店,南口路29号北京乐多港万达广场F1,116.191566,40.231934,北京市,北京市,16619831417,常磊,13552557208,6
深蓝汽车北京延庆莲花池专区店,延庆镇莲花池村东200米,116.008179,40.454716,北京市,北京市,13521876925,肖望远,13718280236,6
深蓝汽车北京通州富河大街专区店,富河大街315号,116.646165,39.927168,北京市,北京市,13167317952,李杰,18600559444,6
深蓝汽车北京朝阳区来广营专区店,来广营乡北苑东路8号,116.441262,40.023771,北京市,北京市,13366834126,高红涛,13366824889,6
深蓝汽车北京怀柔区庙城镇专区店,庙城镇焦村临21号,116.636867,40.248349,北京市,北京市,13240492786,李星月,18301080315,6
深蓝汽车北京平谷区大兴庄镇专区店,大兴庄镇三福庄村临街2号,117.047951,40.145611,北京市,北京市,18001323907,柯帅,13466543418,6
深蓝汽车北京顺义李桥镇专区店,李桥镇顺通路李桥段26号,116.66798,40.048812,北京市,北京市,13366822732,叶阔,13366822732,6
深蓝汽车北京大兴区店,北京市大兴区工业开发区金苑路10号4幢,116.349602,39.758698,北京市,北京市,13552568827,齐子杨,13552568827,2
深蓝汽车天津宝坻店,天津市宝坻区钰华街120号,117.311038,39.708947,天津市,天津市,022-82661086,张志远,18526163531,1
深蓝汽车天津北辰店,天津市北辰区铁东路勤俭工业区汾河北道12增2号,117.180446,39.210038,天津市,天津市,022-86316762,温昂,13820047323,1
深蓝汽车天津滨海新区河北路店,天津市滨海新区河北路4734号,117.659763,39.056946,天津市,天津市,13352058060,王明宇,13352058060,1
深蓝汽车天津河南路汽车街移动展厅,天津市滨海新区河南路汽车街34号,117.658688,39.003624,天津市,天津市,13352058060,,,6
深蓝汽车天津熙悦汇移动展厅,天津市南开区熙悦汇,117.124707,39.137465,天津市,天津市,18630889522,,,6
深蓝汽车天津保税区汽车园移动展厅,天津市东丽区空港保税区汽车园中路35号,117.37638,39.15974,天津市,天津市,13752576182,,,6
深蓝汽车天津环渤海汽车园移动展厅,天津市河西区环渤海汽车园,117.234226,39.054853,天津市,天津市,13478497708,,,6
深蓝汽车天津津南科技园移动展厅,天津市津南区聚海道与海鑫路交口,117.423084,38.973551,天津市,天津市,13478497708,,,6
深蓝汽车天津坤港互联科技园移动展厅,天津市津南区双港辛庄慧科路与睿科道交口,117.301241,39.016117,天津市,天津市,13478497708,,,6
深蓝汽车天津东丽跃进路移动展厅,天津市东丽区跃进路南何南路,117.239855,39.19038,天津市,天津市,13478497708,,,6
深蓝汽车天津宁河区移动展厅,天津市宁河区芦汗公里大陈驾校旁,117.832012,39.315644,天津市,天津市,13478497708,,,6
深蓝汽车天津空港店,天津市东丽区华明街赵家村津汉路16号,117.362307,39.131072,天津市,天津市,13752576182,段辉韵,18933990709,1
深蓝汽车天津津南店,天津市津南区葛沽镇滨海盛世汽车园内长安博雅店,117.490807,38.99217,天津市,天津市,022-88690330,董单,15332188875,1
深蓝汽车天津静海店,天津市静海区金海道2号,116.999575,38.947417,天津市,天津市,18920271308,郝宝会,18920271308,1
深蓝汽车天津南开店,天津市南开区咸阳路91号咸阳路门脸10-1号,117.135242,39.137771,天津市,天津市,18630889522,赵云菲,18630889522,1
深蓝汽车天津武清店,天津市武清区下朱庄街京津公路东侧101号,117.081199,39.340855,天津市,天津市,022-29310003,王凯歌,13820075712,1
深蓝汽车天津西青区大寺店,天津市西青区大寺高新技术产业园储华道7号,117.270492,38.99541,天津市,天津市,13478497708,聂婷婷,13478497708,1
深蓝汽车天津西青区中北店,天津市西青区卉康路22号,117.091505,39.114859,天津市,天津市,18002028471,庞梦瑶,18002028471,1
深蓝汽车天津北辰店,天津市北辰区铁东路勤俭工业区汾河北道12增2号,117.184793,39.204602,天津市,天津市,022-86316762,李昊,18602696701,3
深蓝汽车天津西青区大寺店,天津市西青区大寺高新技术产业园储华道7号,117.270492,38.99541,天津市,天津市,022-83966161,鲍靖轩,13820567168,3
深蓝汽车天津滨海新区河北路店,天津市滨海新区河北路4734号,117.659763,39.056946,天津市,天津市,13352058060,王明宇,13352058060,3
深蓝汽车天津武清店,天津市武清区下朱庄街京津公路东侧101号,117.081188,39.340859,天津市,天津市,022-82259569,冯坤,13820405269,2
深蓝汽车天津津南店,天津市津南区葛沽镇滨海盛世汽车园内长安博雅店,117.480747,38.981832,天津市,天津市,16622381890,白勇,18649133066,2
深蓝汽车天津静海店,天津市静海县津德路91号,116.931136,38.922503,天津市,天津市,022-68907300,邓陆,17612281490,2
深蓝汽车天津宝坻店,宝坻区经济开发区东区120号,117.311029,39.708842,天津市,天津市,022-82660333,黄天龙,15022333724,2
深蓝汽车天津滨海新区河北路店,天津市滨海新区丹江路128号,117.665755,39.06031,天津市,天津市,022-25211211,李国宏,15522186689,2
深蓝汽车天津西青区中北店,天津市西青区杨柳青镇伍街村委会旁长安汽车,117.011209,39.155609,天津市,天津市,022-60318601,刘党委,18102157750,2
深蓝汽车天津西青店,天津市西青区大寺高新技术产业园储华道7号,117.270463,38.995392,天津市,天津市,022-87979191,史振朋,13820022722,2
深蓝汽车天津空港店,天津自贸试验区（空港经济区）汽车园中路35号东侧,117.376694,39.159721,天津市,天津市,152222301168,李亮,18526078280,2
深蓝汽车天津津南店,天津市津南区葛沽镇滨海盛世汽车园内长安博雅店,117.48539,38.989632,天津市,天津市,022-88690330,董单,15332188875,3
深蓝汽车天津北辰汾河北道店,天津市北辰区天穆镇铁东路汾河北道12号增2号,117.186892,39.202101,天津市,天津市,18003334664,于爱军,13102257346,2
深蓝汽车保定定州店,河北省定州经济开发区银河大道西侧,114.924136,38.540845,保定市,河北省,0312-2355126,宋子豪,18617771500,1
深蓝汽车保定北大街车管所店,保定市莲池区长城北大街2416号车管所对面,115.55632,38.913592,保定市,河北省,0312-5921818,周航,18131293513,1
深蓝汽车沧州新华店,河北省沧州市开发区车管所东行路北,116.926474,38.287496,沧州市,河北省,0317-3097706,刘在南,15630770662,1
深蓝汽车保定莲池区移动展厅,河北省保定市莲池区车管所对面,115.556802,38.916113,保定市,河北省,18131293513,,,6
深蓝汽车沧州浅海大厦移动展厅,河北省沧州市黄骅市迎宾大街东侧浅海大厦南,117.335263,38.344663,沧州市,河北省,18713728777,,,6
深蓝汽车廊坊固安县移动展厅,河北省潍坊市固安县106国道金海汽车交易市场,116.315985,39.375214,廊坊市,河北省,13513016555,,,6
深蓝汽车石家庄又一城广场移动展厅,河北省石家庄市栾城区古栾水镇又一城广场,114.593287,37.952406,石家庄市,河北省,15710331330,,,6
深蓝汽车石家庄冀安驾校移动展厅,河北省石家庄市新华区冀安驾校,114.390959,38.072433,石家庄市,河北省,13303019907,,,6
深蓝汽车唐山任各庄镇移动展厅,河北省唐山市丰润区任各庄镇村南1500米,118.172382,39.71144,唐山市,河北省,18633319190,,,6
深蓝汽车邯郸时代汽车广场店,河北省邯郸市时代汽车广场时代汽车广场A馆02展厅,114.561739,36.656088,邯郸市,河北省,0310-5601688,王莹莹,17713031502,1
深蓝汽车邯郸万合店,河北省邯郸市南环路赵王城遗址公园对面万合汽车园区,114.430982,36.564865,邯郸市,河北省,0310-5500550,王鹏,18131079873,1
深蓝汽车衡水北外环店,河北省衡水市桃城区榕花街与北外环交叉口东行500米路南,115.699369,37.774718,衡水市,河北省,0318-6921999,张佳欢,15931375872,1
深蓝汽车廊坊安次店,河北省廊坊市安次区杨税务乡安次高新技术产业园区西昌路西侧、安锦道北侧庞大汽车园区6号南延展厅,116.658772,39.514417,廊坊市,河北省,0316-6060006,康展鹏,18131157136,1
深蓝汽车石家庄北二环国际汽车园区店,河北省石家庄长安区北二环东路86号园区内东4排8号,114.547628,38.074387,石家庄市,河北省,0311-68003666,牛晓明,15373895343,1
深蓝汽车石家庄新华康城店,河北省石家庄市新华区和平西路70号,114.390819,38.072445,石家庄市,河北省,0311-82211888,秦日刚,15100105943,1
深蓝汽车石家庄裕华南二环店,河北省石家庄市裕华区南二环与富强大街交叉口西行100米路北石栾路35号,114.522187,38.001996,石家庄市,河北省,0311-85216333,崔鑫淼,18810898895,1
深蓝汽车唐山开平店,唐山市开平区开平镇西八里庄东外环开越路北,118.260964,39.648407,唐山市,河北省,15003250523,刘京杭,15003250523,1
深蓝汽车唐山时代中心店,河北省唐山市高新区龙富南道188号时代中心购物商场,118.176739,39.67207,唐山市,河北省,0315-5501070,何永秋,18910824185,1
深蓝汽车邢台襄都店,河北省邢台市襄都区龙岗汽车园19号,114.548321,37.122771,邢台市,河北省,0319-3909986,付瑞杰,15930946366,1
深蓝汽车保定定州店,河北省定州经济开发区银河大道西侧,114.924136,38.540845,保定市,河北省,0312-2355126,杨博,13483771119,3
深蓝汽车保定北大街车管所店,保定市莲池区长城北大街2416号车管所对面,115.55632,38.913592,保定市,河北省,0312-5921818,周航,18131293513,3
深蓝汽车保定涿州店,河北省保定市涿州市城西北街6号,115.9635,39.485771,保定市,河北省,0312-3630088,牛广欣,15630229296,3
深蓝汽车沧州南仓街店,河北省沧州市泊头市104国道东侧（南仓街）,116.58509,38.0412,沧州市,河北省,0317-8295555,赵丹,15233170920,3
深蓝汽车沧州新华店,河北省沧州市开发区车管所东行路北,116.932738,38.293311,沧州市,河北省,0317-3097706,刘在南,15630770662,3
深蓝汽车承德双桥店,河北省承德市双桥区大石庙太平庄长安铃木汽车专卖店,117.985824,40.888367,承德市,河北省,0314-2121998,费百杰,18103148185,3
深蓝汽车邯郸万合店,河北省邯郸市南环路赵王城遗址公园对面万合汽车园区,114.430982,36.564865,邯郸市,河北省,0310-5500550,王鹏,18131079873,3
深蓝汽车衡水北外环店,河北省衡水市桃城区榕花街与北外环交叉口东行500米路南,115.707451,37.768291,衡水市,河北省,0318-6921999,张佳欢,15931375872,3
深蓝汽车廊坊安次店,河北省廊坊市安次区杨税务乡安次高新技术产业园区西昌路西侧、安锦道北侧庞大汽车园区6号南延展厅,116.672871,39.491631,廊坊市,河北省,0316-6060006,康展鹏,18131157136,3
深蓝汽车秦皇岛东港路店,河北省秦皇岛市海港区东港路492号,119.635943,39.967225,秦皇岛市,河北省,0335-8930666,刘建菲,17733592369,3
深蓝汽车秦皇岛瑞通汽车园店,河北省秦皇岛市海港区秦青公路西侧瑞通汽车园内,119.549317,39.970793,秦皇岛市,河北省,0335-2121769,李波,16716095355,3
深蓝汽车秦皇岛秦皇西大街店,河北省秦皇岛经济技术开发区秦皇西大街293号,119.486753,39.91851,秦皇岛市,河北省,0335-5285555,王平新,18131293501,3
深蓝汽车石家庄北二环国际汽车园区店,河北省石家庄长安区北二环东路86号园区内东4排8号,114.547628,38.074387,石家庄市,河北省,0311-68003666,牛晓明,15373895343,3
深蓝汽车石家庄新华康城店,河北省石家庄市新华区和平西路70号,114.390819,38.072445,石家庄市,河北省,0311-82211888,秦日刚,15100105943,3
深蓝汽车石家庄润丰广场店,河北省石家庄市裕华区石栾大街辅路与广源路交叉口北180米,114.551814,37.979659,石家庄市,河北省,0311-67902676,王启,18031832383,3
深蓝汽车石家庄裕华南二环店,河北省石家庄市裕华区南二环与富强大街交叉口西行100米路北石栾路35号,114.522187,38.0538001996,石家庄市,河北省,0311-85216333,崔鑫淼,18810898895,3
深蓝汽车唐山开平店,唐山市开平区开平镇西八里庄东外环开越路北,118.260964,39.648407,唐山市,河北省,15003250523,刘京杭,15003250523,3
深蓝汽车唐山路南店,河北省唐山市路南区吉祥新路南方灯具城汽车园长安汽车4S店,118.20044,39.590744,唐山市,河北省,0315-2978300,刘磊,13269512555,3
深蓝汽车邢台襄都店,河北省邢台市襄都区龙岗汽车园19号,114.548321,37.122771,邢台市,河北省,0319-3909986,付瑞杰,15930946366,3
深蓝汽车任丘西环路店(建设中),河北省沧州市任丘市西环路小于庄村西（106国道西侧）,116.094864,38.305927,沧州市,河北省,0317-3338355,远海涛,13663175859,3
深蓝汽车沧州南仓街店,河北省沧州市泊头市104国道东侧（南仓街）,116.591108,38.057852,沧州市,河北省,0317-8088899,郑元帅,13373477661,2
深蓝汽车保定定州店,河北省定州经济开发区银河大道西侧,114.925003,38.550318,保定市,河北省,0312-2351999,王欢欢, 15231225716,2
深蓝汽车邯郸时代汽车广场店,河北省邯郸市经济开发区时代汽车广场A馆02展厅,114.564608,36.656201,邯郸市,河北省,0310-5601699,肖利辉,13131060277,2
深蓝汽车石家庄北二环国际汽车园区店,河北省石家庄市新华区北二环西路125号院,114.462728,38.086453,石家庄市,河北省,0311-68003555,刘吉云,15176993700,2
深蓝汽车保定北大街车管所店,河北省保定市北市区西百楼村东三环与复兴路交叉口北行1500米,115.553872,38.914711,保定市,河北省,0312-5921212,米吉庆,15033844585,2
深蓝汽车廊坊安次店,河北省廊坊市安次区杨税务乡庞大汽车园区6号南延展厅,116.666184,39.485475,廊坊市,河北省,0316-2808977,门红宇,13191989234,2
深蓝汽车任丘西环路店,河北省沧州市任丘市西环路小于庄村西（106国道西侧）,116.080298,38.714027,沧州市,河北省,0317-3339122,王巧变,13930753491,2
深蓝汽车唐山开平店,河北省唐山市开平区开平镇西八里庄开越路北,118.259894,39.65159,唐山市,河北省,0315-5780030,梅天启	,18201574913,2
深蓝汽车秦皇岛秦皇西大街店,秦皇岛市经济技术开发区秦皇西大街293号1号店,119.486506,39.918343,秦皇岛市,河北省,0335-8992000,陈胜琦,18533573162,2
深蓝汽车邯郸南环路店,河北省邯郸市北张庄镇郑家岗村北,114.430355,36.564727,邯郸市,河北省,0310-5502850,史松,13315007062,2
深蓝汽车衡水北外环店,河北省衡水市北外环与榕花大街交叉口东行500米路南,115.631923,37.737093,衡水市,河北省,0318-2052777,李亚亚,15903289406,2
深蓝汽车唐山丰润店,河北省唐山市丰润区任各庄镇任各庄村南长安汽车4S店,118.167767,39.724474,唐山市,河北省,0315-3162741,赵智杨,15231569876,2
深蓝汽车沧州新华店,河北省沧州市开发区石港路37号市交警支队斜对面,116.926473,38.287559,沧州市,河北省,0317-3097706,于艳,15076478238,2
深蓝汽车秦皇岛东港路店,河北省秦皇岛市海港区东港路492号,119.636391,39.967189,秦皇岛市,河北省,0335-5995588,李云柯,17733592377,2
深蓝汽车邢台襄都店,河北省邢台市襄都区龙岗汽车园19号,114.54824,37.122754,邢台市,河北省,0319-3909981,刘亮,18733955250,2
深蓝汽车石家庄裕华南二环店,河北省石家庄市裕华区南二环与富强大街交叉口西行100米路北石栾路35号,114.522147,38.001952,石家庄市,河北省,0311-85215006,付饶,13739739562,2
深蓝汽车秦皇岛瑞通汽车园店,河北省秦皇岛市经济技术开发区秦皇西大街293号,119.487095,39.917033,秦皇岛市,河北省,0335-5319769,计程,13313333527,2
深蓝汽车石家庄新华康城店,石家庄鹿泉开发区龙泉东路与翠柏大街交口东讯汽车园北门001号,114.346613,38.068836,石家庄市,河北省,0311-82215588,张云辉,13513319203,2
深蓝汽车承德双桥店,河北省承德市双桥区太平庄村汽车城长安汽车展厅,117.98659,40.889386,承德市,河北省,0314-2121769,郭德良,13293269328,2
深蓝汽车保定世纪车城店,河北省保定市莲池区长城南大街1485号世纪汽车城园区,115.506576,38.830604,保定市,河北省,0312-5939355,王浩亮,15175211010,2
深蓝汽车张家口高新区店,张家口市高新区玉宝墩北白云路7号,114.905687,40.754208,张家口市,河北省,0313-4087628,李启亮,17734033334,2
深蓝汽车廊坊广阳店,廊坊市广阳区万庄镇廊万路190号,116.649245,39.546397,廊坊市,河北省,0316-5179991,赵军,15630688787,2
深蓝汽车邯郸时代汽车广场店,河北省邯郸市时代汽车广场时代汽车广场A馆02展厅,114.561739,36.656088,邯郸市,河北省,0310-5601688,王莹莹,17713031502,3
深蓝汽车保定高碑店市店,河北省保定市高碑店市五四东路北侧科苑路东侧,115.908222,39.339591,保定市,河北省,18931223682,荆思杰,18332839289,2
深蓝汽车长治潞州店,山西省长治市潞州区关村汽贸园东区西二排8-12号,113.148335,36.224597,长治市,山西省,0355-3508566,宋绍峰,18633060769,1
深蓝汽车长治北寨汽车园店,山西省长治市城区西二环路2号（北寨汽车园）,113.074033,36.211867,长治市,山西省,0355-2082419,王思静,15103455600,1
深蓝汽车大同云冈店,山西省大同市云冈区南环路西延线庞大汽车园内43#店,113.256306,40.041417,大同市,山西省,0352-5165222,韩文静,18636254872,1
深蓝汽车晋城月星商业广场移动展厅,山西省晋城市城区红星东街月星商业广场,112.903095,35.49488,晋城市,山西省,18435610904,,,6
深蓝汽车临汾城南汽车移动展厅,山西省临汾市尧都区城南汽车商圈金井村对面动物园东门,111.470257,36.024197,临汾市,山西省,0357-2595556,,,6
深蓝汽车吕梁通运汽车园移动展厅,山西省吕梁市孝义市振兴街苏家庄通运汽车园,111.747215,37.156861,吕梁市,山西省,15035867304,,,6
深蓝汽车太原鼎晨汇豪移动展厅,山西省太原市万柏林区鼎晨汇豪新能源汽贸城,112.52892,37.825307,太原市,山西省,0351-6160010,,,6
深蓝汽车太原新汇众家园移动展厅,山西省太原市小店区马练营路新汇众家园,112.603938,37.76205,太原市,山西省,13663616552,,,6
深蓝汽车太原空港汽贸园移动展厅,山西省太原市小店区龙城大街空港汽贸园西2号,112.6233,37.7735,太原市,山西省,15135080525,,,6
深蓝汽车运城绛县移动展厅,山西省运城市绛县古绛镇涑水大街楠华汽贸,111.562685,35.478745,运城市,山西省,15503590259,,,6
深蓝汽车运城河津市移动展厅,山西省运城市河津市永兴路,110.696954,35.575363,运城市,山西省,13111248208,,,6
深蓝汽车长治幸福广场移动展厅,山西省长治市上党区上党区正大南路与振东东街交叉口东北300米幸福广场 ,113.06744,36.044733,长治市,山西省,0355-3508566,,,6
深蓝汽车晋中榆次店,山西省晋中市榆次区汇通北路使张村壳牌加油站旁,112.69048,37.72648,晋中市,山西省,0354-2759111,于雯馨,18503455211,1
深蓝汽车临汾尧都店,临汾市尧都区尧庙镇霍侯一级路十字路口西南角,111.476294,36.022876,临汾市,山西省,0357-2595556,赵志新,15364973330,1
深蓝汽车朔州朔城店,朔州市开发区振华街振华车城20B号,112.46561,39.34772,朔州市,山西省,0349-6664496,尹海文,15513350505,1
深蓝汽车太原长风西街店,山西省太原市万柏林区长风西街18号（1-10）,112.525579,37.817929,太原市,山西省,0351-6160010,张雷,13994260832,1
深蓝汽车太原万柏林店,山西省太原市迎泽大街新西客站往北300米路东,112.472725,37.856604,太原市,山西省,0351-7019008,魏德武,18435174986,1
深蓝汽车太原汾东北路店,太原市小店区汾东北路55号,112.561151,37.74152,太原市,山西省,0351-2983575,梁永旺,15135080525,1
深蓝汽车太原太榆路店,太原市小店区太榆路与中心街交叉口鸿城新能源车城长安4S店,112.617131,37.78086,太原市,山西省,0351-5655777,王新太,18235121789,1
深蓝汽车忻州忻府店,山西省忻州市经济开发区梨花街北、经一路西,112.734876,38.465368,忻州市,山西省,0350-2024666,邢舟,13935450808,1
深蓝汽车运城盐湖工业园店,运城市盐湖工业园区南风大道三号诺维兰文化广场,110.95019,35.117027,运城市,山西省,0359-8713601,郑磊,15935582033,1
深蓝汽车运城解放北路店,山西省运城市盐湖区解放北路皮革城43号,111.01065,35.030376,运城市,山西省,0359-6360099,任文超,19398762584,1
深蓝汽车运城运临路店,山西省运城市运临路东侧东留村口,110.967615,35.038872,运城市,山西省,0359-2586567,肖蕾,13111248208,1
深蓝汽车长治潞州店,山西省长治市潞州区关村汽贸园东区西二排8-12号,113.14587,36.22435,长治市,山西省,0355-3508566,宋绍峰,18633060769,3
深蓝汽车长治北寨汽车园店,山西省长治市城区西二环路2号（北寨汽车园）,113.074033,36.211867,长治市,山西省,0355-2082419,王思静,15103455600,3
深蓝汽车大同云冈店,山西省大同市云冈区南环路西延线庞大汽车园内43#店,113.256306,40.041417,大同市,山西省,0352-5165222,郑荣,15333523335,3
深蓝汽车晋城中原街店,山西省晋城市城区钟家庄街道中原东街447号,112.860673,35.47718,晋城市,山西省,0356-2222284,任莎莎,19135103543,3
深蓝汽车晋中榆次店,山西省晋中市榆次区汇通北路使张村壳牌加油站旁,112.69048,37.72648,晋中市,山西省,0354-2759111,于雯馨,18503455211,3
深蓝汽车临汾尧都店,临汾市尧都区尧庙镇霍侯一级路十字路口西南角,111.48195,36.029411,临汾市,山西省,0357-2595556,赵志新,15364973330,3
深蓝汽车朔州朔城店,朔州市开发区振华街振华车城20B号,112.46561,39.34772,朔州市,山西省,0349-6664496,尹海文,15513350505,3
深蓝汽车太原长风西街店,山西省太原市万柏林区长风西街18号（1-10）,112.525579,37.817929,太原市,山西省,0351-2578800,张雷,13994260832,3
深蓝汽车太原万柏林店,山西省太原市迎泽大街新西客站往北300米路东,112.472725,37.856604,太原市,山西省,0351-7019008,魏德武,18435174986,3
深蓝汽车太原汾东北路店,太原市小店区汾东北路55号,112.561151,37.74152,太原市,山西省,0351-7990600,梁永旺,15135080525,3
深蓝汽车太原太榆路店,太原市小店区太榆路与中心街交叉口鸿城新能源车城长安4S店,112.618185,37.781919,太原市,山西省,0351-5655777,王新太,18235121789,3
深蓝汽车忻州忻府店,山西省忻州市经济开发区梨花街北、经一路西,112.734876,38.465368,忻州市,山西省,0350-2024666,邢舟,13935450808,3
